{"run":38,"commit":"0b423c2","metric":559.606,"metrics":{"wall_ms":219606,"tool_calls":34,"tool_errors":0,"rpc_errors":0,"missing_artifacts":0,"state_failures":0},"status":"discard","description":"Model-stratified gpt-5.5 Johnson correctness and efficiency repeat","timestamp":1784191646330,"segment":0,"confidence":2.28313492233545,"asi":{"hypothesis":"Within-model randomized scenario sampling will preserve correctness while revealing actionable repeated inefficiency rather than cross-model latency noise.","next_action_hint":"Johnson completed cleanly; no repeated correctness or tool failure emerged. Keep production unchanged and evaluate future sol draws only for correctness."}}
{"run":39,"commit":"0b423c2","metric":591.365,"metrics":{"wall_ms":216365,"tool_calls":25,"tool_errors":1,"rpc_errors":1,"missing_artifacts":0,"state_failures":0},"status":"discard","description":"Randomized gpt-5.5 Hamilton repeat after model stratification","timestamp":1784191909730,"segment":0,"confidence":2.331458445165357,"asi":{"hypothesis":"Another randomized within-model sample may reveal a repeated failure shared across value scenarios.","next_action_hint":"Correctness remained complete; isolated CLI/RPC errors were recovered and not scenario-specific. Avoid production changes without recurrence."}}
{"run":40,"commit":"0b423c2","metric":662.604,"metrics":{"wall_ms":232604,"tool_calls":33,"tool_errors":1,"rpc_errors":0,"missing_artifacts":0,"state_failures":0},"status":"discard","description":"Randomized gpt-5.5 Johnson recurrence check","timestamp":1784192188153,"segment":0,"confidence":2.421603801027829,"asi":{"hypothesis":"Repeated randomized sampling will distinguish persistent Johnson workflow defects from recoverable model variance.","next_action_hint":"Johnson again completed correctly; one recovered tool error is not a persistent product defect. Preserve current implementation and seek a distinct workflow."}}
{"run":41,"commit":"0b423c2","metric":795.44,"metrics":{"wall_ms":235440,"tool_calls":26,"tool_errors":3,"rpc_errors":0,"missing_artifacts":0,"state_failures":0},"status":"discard","description":"Broaden benchmark suite with randomized Data workflow draw","timestamp":1784192578399,"segment":0,"confidence":2.5190004286758954,"asi":{"hypothesis":"Adding a 25% Data/menus/tables workflow control will expose overfitting without weakening or replacing the Forms benchmark.","next_action_hint":"This randomized draw selected Johnson and passed; retain diversified harness and obtain a Data sample before judging cross-workflow correctness."}}
{"run":42,"commit":"0b423c2","metric":973.723,"metrics":{"wall_ms":448723,"tool_calls":30,"tool_errors":2,"rpc_errors":1,"missing_artifacts":0,"state_failures":0},"status":"crash","description":"Randomized sol:max correctness control ended after complete artifacts","timestamp":1784193088159,"segment":0,"confidence":2.421603801027829,"asi":{"hypothesis":"Diversified randomized sampling will reach Data coverage while sol:max remains a correctness-only control.","next_action_hint":"This draw selected Johnson; all state/artifacts were correct despite process termination. Stop no-change sampling and make the next iteration target an observed fxdriver skill/code defect."}}
{"run":43,"commit":"0b423c2","metric":998.519,"metrics":{"wall_ms":543519,"tool_calls":33,"tool_errors":1,"rpc_errors":1,"missing_artifacts":0,"state_failures":0,"bare_cli_probes":0},"status":"discard","description":"Discourage bare CLI probing; sol:max correctness control","timestamp":1784193755450,"segment":0,"confidence":2.346877165779799,"asi":{"hypothesis":"Explicitly forbidding bare CLI probes will remove a repeated nonzero usage call without narrowing valid workflows.","next_action_hint":"sol:max completed correctly and made zero bare CLI probes; result is correctness-only. Reapply the one-line skill change and evaluate with gpt-5.5."}}
{"run":44,"commit":"0b423c2","metric":463.589,"metrics":{"wall_ms":223589,"tool_calls":24,"tool_errors":0,"rpc_errors":0,"missing_artifacts":0,"state_failures":0,"bare_cli_probes":0},"status":"discard","description":"Evaluate no-bare-CLI skill rule with gpt-5.5 Johnson","timestamp":1784194047317,"segment":0,"confidence":2.28313492233545,"asi":{"hypothesis":"Explicitly forbidding bare CLI probes will remove a repeated nonzero usage call without narrowing valid workflows.","next_action_hint":"gpt-5.5 completed cleanly with zero bare CLI probes and improved recent Johnson runs, but missed the global best. Reapply and repeat once to separate benefit from variance."}}
{"run":45,"commit":"0b423c2","metric":617.192,"metrics":{"wall_ms":257192,"tool_calls":36,"tool_errors":0,"rpc_errors":0,"missing_artifacts":0,"state_failures":0,"bare_cli_probes":0},"status":"discard","description":"Repeat no-bare-CLI skill rule with gpt-5.5 Johnson","timestamp":1784194369730,"segment":0,"confidence":2.331458445165357,"asi":{"hypothesis":"A second gpt-5.5 sample will confirm whether forbidding bare CLI probes improves total effectiveness beyond eliminating one error.","next_action_hint":"The rule reliably eliminated bare CLI probes but did not improve total calls or score across repeats. Discard it; target a code-path defect rather than model planning style."}}
{"run":46,"commit":"0b423c2","metric":3011.08,"metrics":{"wall_ms":426080,"tool_calls":31,"tool_errors":4,"rpc_errors":75,"missing_artifacts":0,"state_failures":0,"bare_cli_probes":0},"status":"discard","description":"Report executed run-step count; first randomized Data workflow","timestamp":1784195024010,"segment":0,"confidence":2.28313492233545,"asi":{"hypothesis":"Reporting executed versus planned run steps will prevent agents from assuming skipped actions ran after an early failure.","next_action_hint":"Data workflow completed correctly, but score regressed and exposed 75 RPC failure markers. Discard this change; inspect Data events to identify the dominant real code/skill defect."}}
{"run":47,"commit":"0b423c2","metric":771.519,"metrics":{"wall_ms":296519,"tool_calls":35,"tool_errors":1,"rpc_errors":1,"missing_artifacts":0,"state_failures":0,"bare_cli_probes":0},"status":"crash","description":"Expose menu paths in compact summary; harness response lost after completed Johnson run","timestamp":1784196191010,"segment":0,"confidence":2.346877165779799,"asi":{"hypothesis":"Including bounded menu and context-menu paths in snapshotSummary will replace blind fireMenuItem guessing across Data workflows.","next_action_hint":"Underlying Johnson run completed correctly but did not exercise menus; wrapper timed out after metrics. Restart native runner, reapply change, and force one Data gpt-5.5 evaluation."}}
{"run":48,"commit":"d4850e5","metric":779.16,"metrics":{"wall_ms":304160,"tool_calls":35,"tool_errors":1,"rpc_errors":1,"missing_artifacts":0,"state_failures":0,"bare_cli_probes":0},"status":"keep","description":"Expose bounded menu paths in compact summary","timestamp":1784198584862,"segment":0,"confidence":2.1960292925545803,"asi":{"hypothesis":"Including menu and context-menu paths in snapshotSummary will replace blind fireMenuItem guessing on unfamiliar JavaFX apps.","next_action_hint":"Keep: on the comparable Data workflow, RPC failures fell from 75 to 1 and score from 3011.08 to 779.16 while correctness stayed complete. Restore randomized models/scenarios and verify Forms remains clean."}}
{"run":49,"commit":"d4850e5","metric":650.086,"metrics":{"wall_ms":230086,"tool_calls":32,"tool_errors":1,"rpc_errors":0,"missing_artifacts":0,"state_failures":0,"bare_cli_probes":0},"status":"discard","description":"Randomized Forms regression check after menu-summary optimization","timestamp":1784198869648,"segment":0,"confidence":2.368550834597876,"asi":{"hypothesis":"Bounded menu-path summaries improve Data workflows without regressing existing Forms correctness or RPC behavior.","next_action_hint":"Johnson remained fully correct with zero RPC failures; retain menu-summary code and randomized harness. Inspect only repeated tool failures before another source change."}}
{"run":50,"commit":"d4850e5","metric":731.877,"metrics":{"wall_ms":386877,"tool_calls":22,"tool_errors":1,"rpc_errors":1,"missing_artifacts":0,"state_failures":0,"bare_cli_probes":0},"status":"crash","description":"Add successful CLI --help path; sol:max correctness control","timestamp":1784199452020,"segment":0,"confidence":2.4330903798963646,"asi":{"hypothesis":"Making standard --help return exit 0 will prevent agents' legitimate CLI discovery from being counted as a tool failure.","next_action_hint":"sol:max produced complete correct artifacts but did not call --help and terminated late; reapply if reverted, then evaluate with gpt-5.5 where the failure recurs."}}
{"run":51,"commit":"d4850e5","metric":779.855,"metrics":{"wall_ms":304855,"tool_calls":35,"tool_errors":1,"rpc_errors":1,"missing_artifacts":0,"state_failures":0,"bare_cli_probes":0},"status":"discard","description":"Make standard CLI --help return success","timestamp":1784199839729,"segment":0,"confidence":2.532522927348668,"asi":{"hypothesis":"Making --help return exit 0 will eliminate the recurring legitimate CLI-discovery tool error.","next_action_hint":"gpt-5.5 exercised --help successfully, but an unrelated cleanup shell error kept total errors and score worse than best. Discard under the primary metric; revisit only if CLI help failures recur."}}
{"run":52,"commit":"d4850e5","metric":836.803,"metrics":{"wall_ms":361803,"tool_calls":35,"tool_errors":1,"rpc_errors":1,"missing_artifacts":0,"state_failures":0,"bare_cli_probes":0},"status":"discard","description":"Add shutdown exitApp option for launched applications","timestamp":1784200494220,"segment":0,"confidence":2.4670552207843532,"asi":{"hypothesis":"An authenticated shutdown option that exits launched apps will remove fragile platform-specific PID cleanup and late launcher hangs.","next_action_hint":"The agent used exitApp successfully, but the unchanged benchmark still required redundant manual PID termination; score did not improve. Discard rather than weaken the benchmark requirement."}}
{"run":53,"commit":"d4850e5","metric":616.658,"metrics":{"wall_ms":286658,"tool_calls":33,"tool_errors":0,"rpc_errors":0,"missing_artifacts":0,"state_failures":0,"bare_cli_probes":0},"status":"discard","description":"No-change Forms stability sample after menu-path optimization","timestamp":1784200871591,"segment":0,"confidence":2.558369134435004,"asi":{"hypothesis":"The retained menu-summary implementation remains neutral on Forms while randomized runs expose a new repeatable code-path defect.","next_action_hint":"Forms completed with zero tool/RPC errors; no new defect appeared. Keep production unchanged and use the next Data sample to inspect residual failures."}}
{"run":54,"commit":"ab7a158","metric":727.997,"metrics":{"wall_ms":437997,"tool_calls":29,"tool_errors":0,"rpc_errors":0,"missing_artifacts":0,"state_failures":0,"bare_cli_probes":0},"status":"keep","description":"Allow relative screenshot paths when shell and app share working directory","timestamp":1784201786803,"segment":0,"confidence":2.6818078095007998,"asi":{"hypothesis":"Correctly documenting relative screenshot path semantics will remove fragile Windows path conversion without weakening attached-app guidance.","next_action_hint":"Keep on reliability: comparable Data run improved from 32 calls/1 RPC error to 29 calls/0 errors; wall-time variance worsened the old composite score. Replace fitness with reliability-first model-stratified metrics."}}
{"type":"config","name":"Optimize fxdriver reliable control","metricName":"reliability_cost","metricUnit":"points","bestDirection":"lower"}
{"run":55,"commit":"3dc4844","metric":227,"metrics":{"wall_ms":232313,"tool_calls":27,"tool_errors":2,"rpc_errors":0,"missing_artifacts":0,"state_failures":0},"status":"keep","description":"Reliability-first baseline with model-stratified gpt-5.5 sampling","timestamp":1784202115819,"segment":1,"confidence":null,"asi":{"hypothesis":"A lexicographic-style cost—correctness, cleanup, errors, then calls—will reward reliable general control without overvaluing noisy wall time.","next_action_hint":"Baseline established at 227: complete correctness, two tool errors, zero RPC errors, 27 calls. Optimize recurring failures; keep wall time secondary only."}}
{"run":56,"commit":"9949985","metric":39,"metrics":{"wall_ms":300554,"tool_calls":39,"tool_errors":0,"rpc_errors":0,"missing_artifacts":0,"state_failures":0},"status":"keep","description":"Make CLI help and no-argument discovery successful","timestamp":1784202584795,"segment":1,"confidence":null,"asi":{"hypothesis":"Treating no arguments and standard help flags as successful discovery will remove a recurring agent tool failure without hiding invalid commands.","next_action_hint":"Keep: reliability cost fell 227→39 with complete Data correctness and zero tool/RPC errors. Repeat across Forms; then target call count only while errors remain zero."}}
{"run":57,"commit":"eb733c4","metric":29,"metrics":{"wall_ms":242375,"tool_calls":29,"tool_errors":0,"rpc_errors":0,"missing_artifacts":0,"state_failures":0},"status":"keep","description":"Forms reliability regression check after successful CLI discovery change","timestamp":1784202897144,"segment":1,"confidence":19.8,"asi":{"hypothesis":"The retained CLI discovery change generalizes across Forms while preserving zero-error reliability.","next_action_hint":"Keep: Forms achieved cost 29 with complete correctness and zero errors. With reliability floor met across Forms/Data, optimize calls using general response consolidation, not scenario-specific instructions."}}
{"run":58,"commit":"825c267","metric":26,"metrics":{"wall_ms":194275,"tool_calls":26,"tool_errors":0,"rpc_errors":0,"missing_artifacts":0,"state_failures":0},"status":"keep","description":"Make shutdown terminate launched apps while preserving attached apps","timestamp":1784203399116,"segment":1,"confidence":30.923076923076923,"asi":{"hypothesis":"Launch-aware shutdown semantics will remove platform-specific PID cleanup while preserving attached application lifetimes.","next_action_hint":"Keep: reliability cost improved 29→26 with full correctness and zero errors; focused tests prove launched apps exit and attached apps remain alive. Validate Data next."}}
{"run":59,"commit":"825c267","metric":10032,"metrics":{"wall_ms":288672,"tool_calls":32,"tool_errors":0,"rpc_errors":0,"missing_artifacts":1,"state_failures":0},"status":"crash","description":"Data validation after launch-aware shutdown","timestamp":1784203801017,"segment":1,"confidence":15.461538461538462,"asi":{"hypothesis":"Launch-aware shutdown generalizes to the Data workflow with zero errors and preserved correctness.","next_action_hint":"Behavior passed with zero errors, but harness rejected semantically correct full-snapshot.json as missing initial-snapshot.json. Add this filename alias, then rerun Data; do not change fxdriver."}}
{"run":60,"commit":"825c267","metric":32,"metrics":{"wall_ms":238294,"tool_calls":32,"tool_errors":0,"rpc_errors":0,"missing_artifacts":0,"state_failures":0},"status":"discard","description":"Accept semantically equivalent full-snapshot artifact name","timestamp":1784204097034,"segment":1,"confidence":25.125,"asi":{"hypothesis":"Accepting full-snapshot.json as the initial full snapshot will measure behavior rather than arbitrary filename choice.","next_action_hint":"Data passed at cost 32 with complete correctness and zero errors. Keep harness alias; restore randomized scenarios and optimize Data call count without sacrificing reliability."}}
{"run":61,"commit":"825c267","metric":1000,"metrics":{"wall_ms":2505600,"tool_calls":0,"tool_errors":1,"rpc_errors":0,"missing_artifacts":0,"state_failures":0},"status":"crash","description":"Delay reference loading in Data workflow; runner cleanup timeout","timestamp":1784206712524,"segment":1,"confidence":15.461538461538462,"asi":{"hypothesis":"Explicitly deferring reference reads will reduce calls without increasing driver errors.","next_action_hint":"Artifacts and state completed, but Pi/native cleanup exceeded both child and runner budgets before metrics. Restart runner; inspect whether reference deferral caused no protocol reads, then rerun with cleanup instrumentation."}}
{"run":62,"commit":"825c267","metric":135,"metrics":{"wall_ms":363404,"tool_calls":35,"tool_errors":1,"rpc_errors":0,"missing_artifacts":0,"state_failures":0},"status":"discard","description":"Retry deferred reference loading after workstation-lock clarification","timestamp":1784207196343,"segment":1,"confidence":3.3781512605042017,"asi":{"hypothesis":"Deferring protocol references until a method is unclear will reduce Data workflow calls without increasing errors.","next_action_hint":"Discard: cost worsened 32→135, calls 32→35, and one tool error appeared. The prior crash was workstation-lock noise, but the skill change itself still regressed reliability."}}
{"run":63,"commit":"825c267","metric":138,"metrics":{"wall_ms":278958,"tool_calls":38,"tool_errors":0,"rpc_errors":1,"missing_artifacts":0,"state_failures":0},"status":"discard","description":"Add compact one-read protocol quick reference","timestamp":1784207660852,"segment":1,"confidence":1.9514563106796117,"asi":{"hypothesis":"A compact common-method JSON reference will replace two long protocol reads and lower Data calls without sacrificing reliability.","next_action_hint":"Discard: cost worsened 32→138, calls 32→38, and one RPC error appeared. Existing full protocol supports better planning despite extra read calls."}}
{"run":64,"commit":"825c267","metric":2855,"metrics":{"wall_ms":600097,"tool_calls":55,"tool_errors":4,"rpc_errors":14,"missing_artifacts":0,"state_failures":0},"status":"crash","description":"Inline common RPC schemas to avoid protocol reads","timestamp":1784208414768,"segment":1,"confidence":1.8962264150943395,"asi":{"hypothesis":"Embedding common run/menu/table schemas in SKILL.md will avoid reference reads while preserving reliable Data control.","next_action_hint":"Reject decisively: timed out with 55 calls, 4 tool errors, and 14 RPC errors despite correct final state. Restore the proven concise skill and full-protocol lookup."}}
{"run":65,"commit":"d2abac3","metric":25,"metrics":{"wall_ms":336214,"tool_calls":25,"tool_errors":0,"rpc_errors":0,"missing_artifacts":0,"state_failures":0},"status":"keep","description":"Expose app working directory in capabilities","timestamp":1784209101254,"segment":1,"confidence":1.9056603773584906,"asi":{"hypothesis":"Returning the app working directory through capabilities will eliminate shell-specific path discovery and make screenshot paths reliable for launched and attached apps.","next_action_hint":"Keep: Data cost improved 32→25 with complete correctness and zero errors. Restore randomized scenarios, verify Forms, then consider exposing other environment facts only when repeated failures justify them."}}
{"run":66,"commit":"d2abac3","metric":30,"metrics":{"wall_ms":255654,"tool_calls":30,"tool_errors":0,"rpc_errors":0,"missing_artifacts":0,"state_failures":0},"status":"discard","description":"Randomized Forms regression check for capabilities workingDirectory","timestamp":1784209438337,"segment":1,"confidence":3.3949579831932772,"asi":{"hypothesis":"Exposing workingDirectory improves Data path handling without regressing Forms reliability.","next_action_hint":"Forms remained fully correct with zero errors; 30 calls are within model variance. Keep production change and randomized scenarios; target only repeated failures or broadly useful response consolidation."}}
{"run":67,"commit":"d2abac3","metric":130,"metrics":{"wall_ms":361818,"tool_calls":30,"tool_errors":0,"rpc_errors":1,"missing_artifacts":0,"state_failures":0},"status":"discard","description":"Add list/tree/titled-pane state to compact summary","timestamp":1784210159339,"segment":1,"confidence":2.02,"asi":{"hypothesis":"Exposing collection selection and titled-pane expansion in snapshotSummary will eliminate full-snapshot orientation passes on data-heavy apps.","next_action_hint":"Discard: Data regressed 25→130 with 30 calls and one RPC error. Extra summary categories did not alter planning enough to justify added output."}}
{"run":68,"commit":"9006717","metric":18,"metrics":{"wall_ms":224622,"tool_calls":18,"tool_errors":0,"rpc_errors":0,"missing_artifacts":0,"state_failures":0},"status":"keep","description":"Restore randomized workflows after Data-focused optimization","timestamp":1784210587295,"segment":1,"confidence":3.6666666666666665,"asi":{"hypothesis":"The retained capabilities and shutdown improvements generalize under randomized workflows without scenario-specific tuning.","next_action_hint":"Keep: randomized Johnson achieved cost 18 with full correctness and zero errors. Current path is near task-minimum calls; seek distinct repeated failures before adding output."}}
{"run":69,"commit":"4f5a2af","metric":34,"metrics":{"wall_ms":364016,"tool_calls":34,"tool_errors":0,"rpc_errors":0,"missing_artifacts":0,"state_failures":0},"status":"keep","description":"Support timestamp cursors in eventsSince","timestamp":1784211879730,"segment":1,"confidence":9.952380952380953,"asi":{"hypothesis":"Accepting either event cursor or millisecond timestamp in eventsSince will prevent false RPC failures and invalid-history workarounds.","next_action_hint":"Keep on comparable Data reliability: cost improved 637→34 and errors 6→0 with full correctness. Restore randomized scenarios; verify Forms remains zero-error."}}
