{"run":70,"commit":"4f5a2af","metric":230,"metrics":{"wall_ms":249490,"tool_calls":30,"tool_errors":2,"rpc_errors":0,"missing_artifacts":0,"state_failures":0},"status":"discard","description":"Randomized Forms regression check after timestamp events support","timestamp":1784212204774,"segment":1,"confidence":3.6666666666666665,"asi":{"hypothesis":"Timestamp-based events support remains neutral on Forms while randomized workflows preserve zero-error reliability.","next_action_hint":"Forms correctness and RPC reliability remained complete; two jq/shell inspection errors were model-local. Restore randomized harness, retain production change, and target only recurring driver failures."}}
{"run":71,"commit":"4f5a2af","metric":28,"metrics":{"wall_ms":193417,"tool_calls":28,"tool_errors":0,"rpc_errors":0,"missing_artifacts":0,"state_failures":0},"status":"discard","description":"Randomized Forms stability repeat after timestamp events support","timestamp":1784212456688,"segment":1,"confidence":9.952380952380953,"asi":{"hypothesis":"A second randomized Forms sample will distinguish prior shell mistakes from any regression in timestamp event support.","next_action_hint":"Forms completed with full correctness and zero tool/RPC errors; prior errors were variance. Keep production and randomized harness; seek a distinct repeated driver defect."}}
{"run":72,"commit":"4f5a2af","metric":22,"metrics":{"wall_ms":197073,"tool_calls":22,"tool_errors":0,"rpc_errors":0,"missing_artifacts":0,"state_failures":0},"status":"discard","description":"Randomized Forms zero-error variance sample","timestamp":1784212700800,"segment":1,"confidence":12.666666666666666,"asi":{"hypothesis":"Continued randomized sampling will reveal a repeated product failure rather than stochastic planning errors.","next_action_hint":"Hamilton completed fully with zero errors in 22 calls, near the 18-call best. No product defect emerged; retain current implementation and randomized harness."}}
{"run":73,"commit":"4f5a2af","metric":24,"metrics":{"wall_ms":196625,"tool_calls":24,"tool_errors":0,"rpc_errors":0,"missing_artifacts":0,"state_failures":0},"status":"discard","description":"Randomized Johnson zero-error reliability sample","timestamp":1784212992797,"segment":1,"confidence":17.416666666666668,"asi":{"hypothesis":"Another randomized sample may expose a repeated driver failure while guarding against benchmark-specific tuning.","next_action_hint":"Johnson completed fully with zero errors in 24 calls. No recurring product defect appeared; retain implementation and continue broad sampling only until Data coverage recurs."}}
{"run":74,"commit":"4f5a2af","metric":446,"metrics":{"wall_ms":337070,"tool_calls":46,"tool_errors":4,"rpc_errors":0,"missing_artifacts":0,"state_failures":0},"status":"discard","description":"Forced Data coverage after randomized Forms stability","timestamp":1784213410093,"segment":1,"confidence":12.666666666666666,"asi":{"hypothesis":"A focused Data sample will reveal whether any driver-level reliability failure recurs after timestamp event support.","next_action_hint":"Data completed fully with zero RPC errors; four failures were jq/process-existence inspection mistakes, not driver defects. Keep production unchanged and randomized harness restored."}}
{"run":75,"commit":"4f5a2af","metric":23,"metrics":{"wall_ms":212220,"tool_calls":23,"tool_errors":0,"rpc_errors":0,"missing_artifacts":0,"state_failures":0},"status":"discard","description":"Randomized Forms reliability floor confirmation","timestamp":1784213678419,"segment":1,"confidence":17.416666666666668,"asi":{"hypothesis":"Randomized post-Data sampling will confirm the current driver remains at a zero-error reliability floor across workflow types.","next_action_hint":"Hamilton completed fully with zero errors in 23 calls. Current implementation remains stable; avoid speculative source changes without a repeated driver failure."}}
{"run":76,"commit":"ac888fa","metric":18,"metrics":{"wall_ms":205170,"tool_calls":18,"tool_errors":0,"rpc_errors":0,"missing_artifacts":0,"state_failures":0},"status":"keep","description":"Allow launch JSON files as direct RPC endpoints","timestamp":1784214085555,"segment":1,"confidence":16.076923076923077,"asi":{"hypothesis":"Letting RPC read port/token directly from saved launch JSON will eliminate repeated jq parsing and endpoint boilerplate without narrowing workflows.","next_action_hint":"Keep: agent adopted the helper immediately and tied the 18-call best with complete correctness and zero errors. Verify on Data, where repeated endpoint parsing was costlier."}}
{"run":77,"commit":"ac888fa","metric":19,"metrics":{"wall_ms":258619,"tool_calls":19,"tool_errors":0,"rpc_errors":0,"missing_artifacts":0,"state_failures":0},"status":"discard","description":"Data regression check for launch-JSON RPC endpoints","timestamp":1784214400017,"segment":1,"confidence":16.076923076923077,"asi":{"hypothesis":"Direct launch-JSON RPC endpoints will reduce Data workflow endpoint parsing while preserving zero-error control.","next_action_hint":"Validated: Data fell to 19 calls with complete correctness and zero errors, versus recent 34–46 calls. Retain helper and randomized harness; seek only distinct failures."}}
{"run":78,"commit":"ac888fa","metric":232,"metrics":{"wall_ms":338083,"tool_calls":32,"tool_errors":2,"rpc_errors":0,"missing_artifacts":0,"state_failures":0},"status":"discard","description":"Randomized Data recurrence check after endpoint helper","timestamp":1784214820474,"segment":1,"confidence":14.413793103448276,"asi":{"hypothesis":"Randomized sampling will expose any repeated driver-level reliability defect after direct endpoint support.","next_action_hint":"Found a real CLI defect: rpc exits nonzero when an app-level result contains nested `error`, contradicting protocol docs. Add a top-level JSON-RPC error check, test it, then rerun Data."}}
{"run":79,"commit":"1753554","metric":29,"metrics":{"wall_ms":274946,"tool_calls":29,"tool_errors":0,"rpc_errors":0,"missing_artifacts":0,"state_failures":0},"status":"keep","description":"Distinguish top-level JSON-RPC errors from app-level result errors","timestamp":1784217555045,"segment":1,"confidence":16.076923076923077,"asi":{"hypothesis":"Checking only top-level JSON-RPC errors will stop valid app-level failure responses from causing false CLI exit failures.","next_action_hint":"Keep: comparable Data reliability improved 232→29 with complete correctness and zero tool/RPC errors. Restore randomized coverage and fix future observed defects in the same iteration."}}
{"run":80,"commit":"1753554","metric":23,"metrics":{"wall_ms":249715,"tool_calls":23,"tool_errors":0,"rpc_errors":0,"missing_artifacts":0,"state_failures":0},"status":"discard","description":"Randomized Forms regression check for top-level RPC error handling","timestamp":1784218034739,"segment":1,"confidence":19.904761904761905,"asi":{"hypothesis":"Top-level RPC error detection fixes Data shell reliability without regressing normal Forms control.","next_action_hint":"Hamilton completed fully with zero errors in 23 calls. Retain fix; no new defect appeared. Continue randomized coverage and fix any observed product defect immediately."}}
{"run":81,"commit":"1753554","metric":21,"metrics":{"wall_ms":189585,"tool_calls":21,"tool_errors":0,"rpc_errors":0,"missing_artifacts":0,"state_failures":0},"status":"discard","description":"Randomized Johnson reliability-floor sample","timestamp":1784218293775,"segment":1,"confidence":23.22222222222222,"asi":{"hypothesis":"Continued randomized sampling will guard against scenario-specific overfitting and reveal any remaining repeated product defect.","next_action_hint":"Johnson completed fully with zero errors in 21 calls, near best. No product defect emerged; retain current implementation."}}
{"run":82,"commit":"1753554","metric":10025,"metrics":{"wall_ms":226970,"tool_calls":25,"tool_errors":0,"rpc_errors":0,"invalid_artifacts":1,"missing_artifacts":0,"state_failures":0},"status":"crash","description":"One-call protocol instruction exposed invalid event JSON","timestamp":1784218624475,"segment":1,"confidence":19,"asi":{"hypothesis":"Reading the protocol in one call will save a tool call without losing operational detail.","next_action_hint":"Crash exposed a recurring product defect: malformed request params can poison events JSON with unescaped Windows paths. Discard instruction change; fix event serialization immediately and rerun."}}
{"run":83,"commit":"ad16253","metric":128,"metrics":{"wall_ms":201428,"tool_calls":28,"tool_errors":0,"rpc_errors":1,"invalid_artifacts":0,"missing_artifacts":0,"state_failures":0},"status":"keep","description":"Keep events JSON valid after malformed request params","timestamp":1784219034996,"segment":1,"confidence":16.076923076923077,"asi":{"hypothesis":"Wrapping malformed raw params will prevent one bad request from poisoning the complete events response.","next_action_hint":"Keep: invalid events artifact is fixed and correctness restored. One malformed Windows-path screenshot RPC remains; repair invalid string escapes in the CLI immediately, then rerun Johnson."}}
