{"type":"config","name":"Optimize fxdriver agent effectiveness","metricName":"effectiveness_score","metricUnit":"points","bestDirection":"lower"}
{"run":1,"commit":"f62abe6","metric":0,"metrics":{"wall_ms":8900,"tool_calls":0,"tool_errors":1,"missing_artifacts":13},"status":"crash","description":"Baseline harness startup; failed before Pi session","timestamp":1784127984699,"segment":0,"confidence":null,"asi":{"hypothesis":"The harness can package Forms with JavaFX 26 and launch an ephemeral gpt-5.5:high Pi session.","next_action_hint":"Inspect harness failure output, fix setup, then rerun unchanged baseline."}}
{"run":2,"commit":"f62abe6","metric":0,"metrics":{"wall_ms":3500,"tool_calls":0,"tool_errors":1,"missing_artifacts":13},"status":"crash","description":"Baseline harness packaging retry; failed before Pi session","timestamp":1784128048924,"segment":0,"confidence":null,"asi":{"hypothesis":"Using JAVA_HOME directly will package Forms and start the Pi baseline.","next_action_hint":"Expose setup exceptions and inspect the exact packaging failure."}}
{"run":3,"commit":"f62abe6","metric":0,"metrics":{"wall_ms":3400,"tool_calls":0,"tool_errors":1,"missing_artifacts":13},"status":"crash","description":"Instrumented baseline setup failure","timestamp":1784128102620,"segment":0,"confidence":null,"asi":{"hypothesis":"Persisting setup diagnostics will reveal the pre-session failure.","next_action_hint":"Read setup-error.txt and correct the failing executable or arguments."}}
{"run":4,"commit":"f62abe6","metric":0,"metrics":{"wall_ms":9400,"tool_calls":0,"tool_errors":1,"missing_artifacts":13},"status":"crash","description":"Windows-native baseline harness re-exec","timestamp":1784128216699,"segment":0,"confidence":null,"asi":{"hypothesis":"Re-executing with Windows Node will use native Pi/JDK/JavaFX installations.","next_action_hint":"Inspect persisted Windows setup error and fix the remaining packaging path issue."}}
{"run":5,"commit":"f62abe6","metric":0,"metrics":{"wall_ms":7800,"tool_calls":0,"tool_errors":1,"missing_artifacts":13},"status":"crash","description":"Instrumented Windows re-exec failure","timestamp":1784128263173,"segment":0,"confidence":null,"asi":{"hypothesis":"Persisting re-exec diagnostics will isolate whether Windows Node starts and resolves the script.","next_action_hint":"Read reexec-error.txt; correct Windows path/cwd/environment."}}
{"run":6,"commit":"f62abe6","metric":0,"metrics":{"wall_ms":3900,"tool_calls":0,"tool_errors":1,"missing_artifacts":13},"status":"crash","description":"Native hidden-runner baseline bridge","timestamp":1784128421698,"segment":0,"confidence":null,"asi":{"hypothesis":"A hidden Windows runner can execute the JavaFX/Pi benchmark while run_experiment only coordinates through files.","next_action_hint":"Inspect native setup diagnostics; fix the first Windows-native packaging error."}}
{"run":7,"commit":"f62abe6","metric":0,"metrics":{"wall_ms":16700,"tool_calls":0,"tool_errors":1,"missing_artifacts":13},"status":"crash","description":"Java 26 native packaging baseline retry","timestamp":1784128485573,"segment":0,"confidence":null,"asi":{"hypothesis":"Selecting the concrete Java 26 install will package Forms and reach Pi execution.","next_action_hint":"Inspect native diagnostics and run artifacts to isolate jar creation or Pi startup."}}
{"run":8,"commit":"36d3268","metric":10601.413,"metrics":{"wall_ms":341413,"tool_calls":46,"tool_errors":3,"rpc_errors":0,"missing_artifacts":12,"state_failures":7},"status":"keep","description":"First complete gpt-5.5:high Forms workflow baseline","timestamp":1784128928793,"segment":0,"confidence":null,"asi":{"hypothesis":"Current fxdriver skill can guide a complex headless JavaFX 26 Forms workflow end-to-end.","next_action_hint":"Fix harness artifact-root tolerance, then shorten stale skill instructions and rerun; session showed redundant reference reads, launch confusion, bytecode inspection, and Python fallback errors."}}
{"run":9,"commit":"3f415c0","metric":1617.939,"metrics":{"wall_ms":422939,"tool_calls":67,"tool_errors":5,"rpc_errors":1,"missing_artifacts":0,"state_failures":0},"status":"keep","description":"Calibrated gpt-5.5 baseline with artifact-directory tolerance","timestamp":1784129515338,"segment":0,"confidence":null,"asi":{"hypothesis":"Accepting project-local artifact directories will measure successful agent output rather than filename placement.","next_action_hint":"Shorten SKILL.md, remove stale video claims, document long-lived launch and run/batch schemas; baseline still had 67 calls, 5 tool errors, and 423s wall time."}}
{"run":10,"commit":"da08893","metric":976.562,"metrics":{"wall_ms":261562,"tool_calls":39,"tool_errors":3,"rpc_errors":1,"missing_artifacts":0,"state_failures":0},"status":"keep","description":"Shorten fxdriver skill and document launch/run/control lifecycle","timestamp":1784130002657,"segment":0,"confidence":1.5226021513088244,"asi":{"hypothesis":"A compact self-contained skill plus missing lifecycle/schema docs will prevent reference fan-out, launcher termination, and bytecode reverse engineering.","next_action_hint":"Inspect the remaining three tool errors; likely simplify launch parsing and remove fragile shell/Python paths without benchmark-specific instructions."}}
{"run":11,"commit":"5eec4d9","metric":888.064,"metrics":{"wall_ms":263064,"tool_calls":35,"tool_errors":2,"rpc_errors":3,"missing_artifacts":0,"state_failures":0},"status":"keep","description":"Accept scalar values and discourage non-observable reverse engineering","timestamp":1784130571192,"segment":0,"confidence":2.433468744648055,"asi":{"hypothesis":"Numeric scalar support plus concise jq/observable-UI guidance will avoid Python and javap detours and let run complete without slider failure.","next_action_hint":"Inspect three RPC failures and two shell errors; then run a randomized gpt-5.6-sol:max control before further changes."}}
{"run":12,"commit":"fcf50d8","metric":467.954,"metrics":{"wall_ms":207954,"tool_calls":26,"tool_errors":0,"rpc_errors":0,"missing_artifacts":0,"state_failures":0},"status":"keep","description":"Repeat gpt-5.5 run with randomized model-control selection","timestamp":1784130928253,"segment":0,"confidence":0.9200681074619353,"asi":{"hypothesis":"The compact skill and scalar fix generalize across repeated runs; randomized 25% control selection avoids choosing only favorable models.","next_action_hint":"Continue random control sampling; if gpt-5.5 repeats remain clean, validate with gpt-5.6-sol:max and a non-Forms Data workflow."}}
{"run":13,"commit":"fcf50d8","metric":1079.391,"metrics":{"wall_ms":409391,"tool_calls":47,"tool_errors":2,"rpc_errors":0,"missing_artifacts":0,"state_failures":0},"status":"discard","description":"No-change gpt-5.5 variance repeat","timestamp":1784131412898,"segment":0,"confidence":1.3371355911620364,"asi":{"hypothesis":"A no-change repeat will estimate model/session variance before further optimization.","next_action_hint":"Treat 208–409s and 26–47 calls as substantial variance; obtain gpt-5.6-sol control and compare medians rather than single best."}}
{"run":14,"commit":"fcf50d8","metric":906.953,"metrics":{"wall_ms":366953,"tool_calls":44,"tool_errors":1,"rpc_errors":0,"missing_artifacts":0,"state_failures":0},"status":"discard","description":"Second no-change gpt-5.5 variance repeat","timestamp":1784131857030,"segment":0,"confidence":4.550797926654929,"asi":{"hypothesis":"Randomized sampling will eventually select the control while characterizing gpt-5.5 variance.","next_action_hint":"Keep the current implementation; continue until gpt-5.6-sol:max is selected, then compare control behavior without attributing model gains to code."}}
{"run":15,"commit":"fcf50d8","metric":597.944,"metrics":{"wall_ms":237944,"tool_calls":26,"tool_errors":1,"rpc_errors":0,"missing_artifacts":0,"state_failures":0},"status":"discard","description":"Randomized 50% control draw selected gpt-5.5","timestamp":1784132189497,"segment":0,"confidence":1.9439481396706175,"asi":{"hypothesis":"Increasing random control probability will obtain a sol sample sooner without choosing its outcome.","next_action_hint":"Retry the random draw; current implementation remains unchanged because this gpt-5.5 run did not beat the best."}}
{"run":16,"commit":"fcf50d8","metric":618.885,"metrics":{"wall_ms":218885,"tool_calls":30,"tool_errors":1,"rpc_errors":0,"missing_artifacts":0,"state_failures":0},"status":"discard","description":"Second randomized 50% control draw selected gpt-5.5","timestamp":1784132485102,"segment":0,"confidence":1.6244567254953692,"asi":{"hypothesis":"A second fair random draw may select the sol control while retaining model provenance.","next_action_hint":"Retry; two consecutive gpt-5.5 selections are plausible and both remain within observed variance."}}
{"run":17,"commit":"fcf50d8","metric":1331.14,"metrics":{"wall_ms":491140,"tool_calls":34,"tool_errors":0,"rpc_errors":0,"missing_artifacts":1,"state_failures":0},"status":"crash","description":"Randomized gpt-5.6-sol:max control timed out before events artifact","timestamp":1784133069244,"segment":0,"confidence":1.4038212891826138,"asi":{"hypothesis":"gpt-5.6-sol:max will complete the same workflow with fewer errors/calls than gpt-5.5.","next_action_hint":"Inspect the control transcript: it produced valid state/artifacts without tool errors but exceeded the run budget before events/cleanup; do not attribute this model difference to code."}}
{"run":18,"commit":"fcf50d8","metric":703.815,"metrics":{"wall_ms":288815,"tool_calls":29,"tool_errors":1,"rpc_errors":1,"missing_artifacts":0,"state_failures":0},"status":"discard","description":"Clarify semantic-state verification and events cursor","timestamp":1784133482546,"segment":0,"confidence":1.6244567254953692,"asi":{"hypothesis":"Explicit semantic-state verification and cursor docs will prevent failed visible-text assertions.","next_action_hint":"Discard because score regressed versus best; variance obscures benefit and the best existing skill already reaches zero RPC/tool errors."}}
{"run":19,"commit":"fcf50d8","metric":783.566,"metrics":{"wall_ms":398566,"tool_calls":26,"tool_errors":1,"rpc_errors":1,"missing_artifacts":0,"state_failures":0},"status":"crash","description":"Second randomized gpt-5.6-sol:max control hit process limit after artifacts","timestamp":1784134057407,"segment":0,"confidence":1.9815251197818424,"asi":{"hypothesis":"A second sol:max control may complete within the runner budget while preserving lower error counts.","next_action_hint":"Both sol controls generated correct state/artifacts but were terminated late; model reasoning latency, not fxdriver effectiveness, is the limiting factor."}}
{"run":20,"commit":"fcf50d8","metric":968.827,"metrics":{"wall_ms":388827,"tool_calls":48,"tool_errors":1,"rpc_errors":0,"missing_artifacts":0,"state_failures":0},"status":"discard","description":"Compress fxdriver skill from 2.0k to 1.75k characters","timestamp":1784134528329,"segment":0,"confidence":2.3036261063907304,"asi":{"hypothesis":"Further skill compression will reduce context and planning overhead without losing operational guidance.","next_action_hint":"Discard; the shorter variant prompted more calls and longer wall time in this run. Keep the proven 2.0k-character version."}}
{"run":21,"commit":"fcf50d8","metric":8871.327,"metrics":{"wall_ms":431327,"tool_calls":34,"tool_errors":1,"rpc_errors":0,"missing_artifacts":8,"state_failures":8},"status":"crash","description":"Value-control summary experiment drew sol:max and timed out mid-workflow","timestamp":1784135240033,"segment":0,"confidence":1.6921747305995518,"asi":{"hypothesis":"Adding bounded value controls to snapshotSummary will reduce full-snapshot probing and calls.","next_action_hint":"Result is inconclusive because randomized sol:max timed out before final artifacts; rerun the same code with gpt-5.5 rather than discarding based on model latency."}}
{"run":22,"commit":"1a1351d","metric":410.509,"metrics":{"wall_ms":180509,"tool_calls":23,"tool_errors":0,"rpc_errors":0,"missing_artifacts":0,"state_failures":0},"status":"keep","description":"Expose bounded value-control state in snapshot summary","timestamp":1784135538353,"segment":0,"confidence":1.4250420039712848,"asi":{"hypothesis":"Including toggle/choice/date/spinner/range values in the compact summary will eliminate full-snapshot probing calls while staying bounded.","next_action_hint":"Keep; restore randomized 25% control selection in the harness, rerun for variance, then verify Java 21/26."}}
{"run":23,"commit":"1a1351d","metric":435.876,"metrics":{"wall_ms":185876,"tool_calls":25,"tool_errors":0,"rpc_errors":0,"missing_artifacts":0,"state_failures":0},"status":"discard","description":"No-change value-summary variance repeat with randomized control restored","timestamp":1784135782428,"segment":0,"confidence":1.4199845033103424,"asi":{"hypothesis":"A repeat will confirm value-summary gains while restoring 25% randomized sol control selection.","next_action_hint":"Result is within noise of the 410.5 best and remains clean; keep production change, leave randomized harness selection enabled."}}
{"run":24,"commit":"0b423c2","metric":399.584,"metrics":{"wall_ms":189584,"tool_calls":21,"tool_errors":0,"rpc_errors":0,"missing_artifacts":0,"state_failures":0},"status":"keep","description":"Randomize equivalent Forms workflow values to resist benchmark overfitting","timestamp":1784136230294,"segment":0,"confidence":1.377305942368675,"asi":{"hypothesis":"Two equivalent randomized state scenarios will expose value-specific overfitting while preserving task complexity.","next_action_hint":"Keep harness diversification; obtain a Johnson scenario sample, then stop changing the proven production path unless a real failure appears."}}
{"run":25,"commit":"0b423c2","metric":851.254,"metrics":{"wall_ms":416254,"tool_calls":31,"tool_errors":1,"rpc_errors":1,"missing_artifacts":0,"state_failures":0},"status":"discard","description":"Successful gpt-5.6-sol:max randomized control","timestamp":1784136701596,"segment":0,"confidence":1.529540334820446,"asi":{"hypothesis":"gpt-5.6-sol:max control will use fewer calls/errors than gpt-5.5 on the diversified workflow.","next_action_hint":"Control completed correctly but was slower and less efficient here; retain gpt-5.5 for bulk tuning and avoid model-based conclusions from one successful sol sample."}}
{"run":26,"commit":"0b423c2","metric":513.432,"metrics":{"wall_ms":183432,"tool_calls":23,"tool_errors":1,"rpc_errors":0,"missing_artifacts":0,"state_failures":0},"status":"discard","description":"Diversified no-change run selected Hamilton again","timestamp":1784136943832,"segment":0,"confidence":1.5774505546563495,"asi":{"hypothesis":"Random scenario selection will produce a Johnson sample to test value generality.","next_action_hint":"Retry; Hamilton remained correct and fast, but one shell error kept this run above best."}}
{"run":27,"commit":"0b423c2","metric":716.676,"metrics":{"wall_ms":271676,"tool_calls":32,"tool_errors":1,"rpc_errors":1,"missing_artifacts":0,"state_failures":0},"status":"discard","description":"Diversified run exposed stale native runner process","timestamp":1784137297777,"segment":0,"confidence":1.6599293380164375,"asi":{"hypothesis":"Another random scenario draw will exercise Johnson values.","next_action_hint":"Restart hidden native runner so it loads scenario propagation; repeated Hamilton selection came from stale server code, not random chance."}}
{"run":28,"commit":"0b423c2","metric":0,"metrics":{"wall_ms":27431000,"tool_calls":0,"tool_errors":1,"rpc_errors":0,"missing_artifacts":1,"state_failures":0},"status":"crash","description":"Restarted native runner hung during diversified Johnson attempt","timestamp":1784184255650,"segment":0,"confidence":1.6599293380164375,"asi":{"hypothesis":"Restarting the native runner will propagate randomized Johnson scenario values.","next_action_hint":"Terminate only runner descendants, inspect partial artifacts/process state, and add runner self-timeout/response guarantees before any further experiment."}}
{"run":29,"commit":"0b423c2","metric":591.531,"metrics":{"wall_ms":241531,"tool_calls":25,"tool_errors":1,"rpc_errors":0,"missing_artifacts":0,"state_failures":0},"status":"discard","description":"Forced gpt-5.5 Johnson scenario generalization check","timestamp":1784187599237,"segment":0,"confidence":2.07042633007938,"asi":{"hypothesis":"The value-summary optimization generalizes to different names, dates, choices, ranges, and spinner targets.","next_action_hint":"Johnson passed all state/artifact checks; restore randomized model/scenario selection. No production change needed."}}
{"run":30,"commit":"0b423c2","metric":938.011,"metrics":{"wall_ms":523011,"tool_calls":29,"tool_errors":1,"rpc_errors":1,"missing_artifacts":0,"state_failures":0},"status":"crash","description":"Randomized sol:max Johnson control terminated after artifacts","timestamp":1784188223661,"segment":0,"confidence":1.7944919107658097,"asi":{"hypothesis":"Randomized control and scenario selection continue validating generalization.","next_action_hint":"Sol again produced all correct artifacts but failed to exit within budget; disable further sol sampling for efficiency because three controls establish the latency pattern."}}
{"run":31,"commit":"0b423c2","metric":588.095,"metrics":{"wall_ms":248095,"tool_calls":24,"tool_errors":1,"rpc_errors":0,"missing_artifacts":0,"state_failures":0},"status":"discard","description":"Bulk gpt-5.5 post-control variance run","timestamp":1784188562128,"segment":0,"confidence":2.07042633007938,"asi":{"hypothesis":"Returning to gpt-5.5 bulk testing will avoid sol latency while retaining randomized scenarios.","next_action_hint":"Current production remains correct; the best clean runs are already near the task's minimum call count. Seek a distinct failure before changing code again."}}
{"run":32,"commit":"0b423c2","metric":574.096,"metrics":{"wall_ms":304096,"tool_calls":27,"tool_errors":0,"rpc_errors":0,"missing_artifacts":0,"state_failures":0},"status":"discard","description":"No-change gpt-5.5 clean variance run","timestamp":1784188962837,"segment":0,"confidence":1.9655087605387176,"asi":{"hypothesis":"Another clean run will refine post-optimization variance.","next_action_hint":"All artifacts/state remained correct with zero errors; call and latency variance now dominate. Avoid adding instructions solely to chase stochastic timing."}}
{"run":33,"commit":"0b423c2","metric":1048.248,"metrics":{"wall_ms":348248,"tool_calls":40,"tool_errors":3,"rpc_errors":0,"missing_artifacts":0,"state_failures":0},"status":"discard","description":"Randomized Johnson no-change variance run","timestamp":1784189402742,"segment":0,"confidence":2.0442111617580103,"asi":{"hypothesis":"Random Johnson sampling will confirm scenario-general correctness under normal model variance.","next_action_hint":"Correctness generalized, but this run had shell detours; inspect only if a repeated Johnson-specific pattern emerges."}}
{"run":34,"commit":"0b423c2","metric":558.048,"metrics":{"wall_ms":228048,"tool_calls":23,"tool_errors":1,"rpc_errors":0,"missing_artifacts":0,"state_failures":0},"status":"discard","description":"Johnson generalization repeat without production changes","timestamp":1784189712251,"segment":0,"confidence":1.9454938056716629,"asi":{"hypothesis":"A repeat may distinguish Johnson-specific friction from normal model variance.","next_action_hint":"Johnson now matches normal call counts; prior 40-call run was variance. Keep production unchanged and pivot to a distinct workflow."}}
{"run":35,"commit":"0b423c2","metric":591.87,"metrics":{"wall_ms":256870,"tool_calls":31,"tool_errors":0,"rpc_errors":1,"missing_artifacts":0,"state_failures":0},"status":"discard","description":"Randomized Forms run with expanded sol:max time budget","timestamp":1784190480449,"segment":0,"confidence":1.9660309775442324,"asi":{"hypothesis":"Increasing only sol:max runner deadlines preserves gpt-5.5 throughput while allowing future sol controls to finish cleanup.","next_action_hint":"This draw selected gpt-5.5 and completed correctly; retain conditional budgets, then obtain a randomized sol:max sample before judging the timeout change."}}
{"run":36,"commit":"0b423c2","metric":728.31,"metrics":{"wall_ms":468310,"tool_calls":26,"tool_errors":0,"rpc_errors":0,"missing_artifacts":0,"state_failures":0},"status":"discard","description":"Expanded-budget randomized sol:max control completed cleanly","timestamp":1784190998390,"segment":0,"confidence":2.030814111572191,"asi":{"hypothesis":"A 20-minute sol:max session budget will prevent late cleanup termination without altering the benchmark task or production implementation.","next_action_hint":"Budget change worked: sol:max completed with zero errors and correct artifacts, but remained slower than gpt-5.5. Keep conditional budgets; optimize only repeated cross-model failures."}}
{"run":37,"commit":"0b423c2","metric":817.367,"metrics":{"wall_ms":317367,"tool_calls":40,"tool_errors":1,"rpc_errors":0,"missing_artifacts":0,"state_failures":0},"status":"discard","description":"Randomized gpt-5.5 stability run after sol correctness control","timestamp":1784191360517,"segment":0,"confidence":2.2367739010204706,"asi":{"hypothesis":"A subsequent randomized run will reveal any repeated cross-model correctness failure before further production changes.","next_action_hint":"No correctness failure repeated; this gpt-5.5 run passed but had stochastic call inflation. Treat sol:max as correctness-only control and compare efficiency only within model."}}
